Crunches,basic,1,20,15,crunch.jpg,This exercise tones up abs
Plank,basic,1,1,25,plank.jpg,This exercise strengthens core
Spin,basic,5,1,40,spin.png,This is an intense cardio workout. It requires a spin bike
Bicep-curls,basic,1,20,10,bicep-curls.jpg,This is a strength exercise to tone and build biceps
Squats,basic,1,10,20,squats.jpg,This exercise strengthens and tones glutes and quads
Crunches,advanced,2,60,60,crunchBall.jpg,This is an advanced exercise to be done with a swiss-ball to tone up abs and strengthen the core
Squats,advanced,2,30,20,squatsWeights.jpg,This is done with weights
