Crunches;basic;1;20;5;This exercise tones up abs
Plank;basic;1;1;10;This exercise strengthens the core
Spin;basic;5;1;20;This is an intense cardio workout. It requires a spin bike
Bicep-curls;basic;1;20;5; This is a strength exercise to tone and build biceps
Squats;basic;1;10;20; This exercise strengthens and tones hams, glutes, and quads
Crunches; advanced; 2; 60; 20;Crunches on a swiss-ball to tone up abs and strengthen the core
Squats; advancecd; 2; 30; 20;The squats are done with weights
